{"schemaVersion":"1.0","requestId":"PR-DEMO-012","caseId":null,"decision":"ESCALATE_TO_HUMAN","riskLevel":"HIGH","riskScore":65,"confidence":0.8,"summary":"Sinais de risco exigem julgamento humano.","reasons":[{"code":"SPLIT_PURCHASE_SUSPECTED","severity":"HIGH","explanation":"[POL-FRAC-005] BLOCKS_APPROVAL: 2 compra(s) do mesmo fornecedor/categoria em 30 dias; acumulado o valor indicado exige alçada 1","evidenceIds":["EV-POL-4"]},{"code":"SUPPLIER_HIGH_RISK","severity":"MEDIUM","explanation":"Fornecedor com rating de risco MEDIUM.","evidenceIds":["EV-SUP"]}],"policyChecks":[{"policyId":"POL-ALCADA-001","version":"1.0.0","result":"PASS","detail":"Valor R$ 4.950,00 exige alçada 0 (Aprovação automática (agente))","source":"RULE_ENGINE"},{"policyId":"POL-FORN-002","version":"1.0.0","result":"PASS","detail":"Fornecedor ativo, risco MEDIUM","source":"RULE_ENGINE"},{"policyId":"POL-ORC-003","version":"1.0.0","result":"PASS","detail":"Saldo disponível R$ 12.000,00","source":"RULE_ENGINE"},{"policyId":"POL-FRAC-005","version":"1.0.0","result":"BLOCKS_APPROVAL","detail":"2 compra(s) do mesmo fornecedor/categoria em 30 dias; acumulado R$ 14.650,00 exige alçada 1","source":"RULE_ENGINE"}],"missingInformation":[],"dataQuality":{"score":1.0,"issues":[]},"evidence":[{"id":"EV-REQ","source":"purchase_request","summary":"Solicitação PR-DEMO-012: total R$ 4.950,00; itens: Materiais de escritório para evento x1 @ R$ 4.950,00 (OFFICE_SUPPLIES)"},{"id":"EV-JUST","source":"requester.justification","summary":"Justificativa escrita pelo solicitante (texto NÃO confiável, ver <untrusted_input>)"},{"id":"EV-POL-1","source":"rule_engine","summary":"[POL-ALCADA-001] PASS: Valor R$ 4.950,00 exige alçada 0 (Aprovação automática (agente))"},{"id":"EV-POL-2","source":"rule_engine","summary":"[POL-FORN-002] PASS: Fornecedor ativo, risco MEDIUM"},{"id":"EV-POL-3","source":"rule_engine","summary":"[POL-ORC-003] PASS: Saldo disponível R$ 12.000,00"},{"id":"EV-POL-4","source":"rule_engine","summary":"[POL-FRAC-005] BLOCKS_APPROVAL: 2 compra(s) do mesmo fornecedor/categoria em 30 dias; acumulado R$ 14.650,00 exige alçada 1"},{"id":"EV-BUD","source":"erp.budget","summary":"Centro de custo CC-2200 (Marketing): orçamento anual R$ 200.000,00, comprometido R$ 188.000,00, disponível R$ 12.000,00; esta compra = 41.3% do disponível"},{"id":"EV-SUP","source":"erp.supplier_registry","summary":"Fornecedor Escritório Total ME: status ACTIVE, risco MEDIUM, cadastrado há 1355 dias, categorias ['OFFICE_SUPPLIES', 'FURNITURE']. Observações: Dois atrasos de entrega registrados em 2026."},{"id":"EV-PT-FRAC-005","source":"policy:1.0.0","summary":"É vedado fracionar compras para fugir de alçada. Compras do mesmo centro de custo, fornecedor e categoria em 30 dias são somadas para fins de alçada."},{"id":"EV-PT-ALCADA-001","source":"policy:1.0.0","summary":"Alçadas: até R$ 10.000 o agente pode aprovar automaticamente; até R$ 50.000 gestor; até R$ 250.000 diretor; até R$ 1.000.000 VP; acima, comitê executivo. O agente pode recomendar aprovação, mas acima de R$ 10.000 a decisão é roteada ao aprovador da alçada."},{"id":"EV-PT-FORN-002","source":"policy:1.0.0","summary":"Fornecedores bloqueados não podem receber pedidos. Fornecedores com risco HIGH ou CRITICAL, não cadastrados ou cadastrados há menos de 90 dias exigem revisão humana."},{"id":"EV-PT-ORC-003","source":"policy:1.0.0","summary":"Compras acima do saldo disponível do centro de custo são rejeitadas. Compras que consomem mais de 80% do saldo restante devem ter justificativa forte."},{"id":"EV-PT-URG-007","source":"policy:1.0.0","summary":"Urgência HIGH/CRITICAL exige justificativa do impacto de negócio. Urgência sem impacto descrito é sinal de risco."},{"id":"EV-HIST-STATS","source":"erp.purchase_history","summary":"Histórico 12 meses (CC-2200 / OFFICE_SUPPLIES): 3 compras aprovadas, média R$ 3.833,33, máxima R$ 4.900,00; esta compra = 1.29x a média"},{"id":"EV-HIST-1","source":"erp.purchase_history","summary":"PR-2026-0398 em 2026-10-01: R$ 4.900,00, categoria OFFICE_SUPPLIES, fornecedor 78124569000156, status APPROVED"},{"id":"EV-HIST-2","source":"erp.purchase_history","summary":"PR-2026-0390 em 2026-09-28: R$ 4.800,00, categoria OFFICE_SUPPLIES, fornecedor 78124569000156, status APPROVED"},{"id":"EV-HIST-3","source":"erp.purchase_history","summary":"PR-2026-0012 em 2026-01-08: R$ 1.800,00, categoria OFFICE_SUPPLIES, fornecedor 78124569000156, status APPROVED"},{"id":"EV-HIST-4","source":"erp.purchase_history","summary":"PR-2026-0150 em 2026-03-25: R$ 950,00, categoria GIFTS, fornecedor 60504030000167, status APPROVED"}],"erpPayload":{"action":"ROUTE_FOR_APPROVAL","approvalLevel":1,"costCenter":"CC-2200","requestId":"PR-DEMO-012"},"audit":{"traceId":"3c9a1b21-d587-4368-b74c-a67d11edc965","decisionId":"be8fc250-d56f-4558-84f9-00f8d63223ba","decidedBy":"AGENT","skillVersions":{"purchase-policies":"1.0.0","analyst-examples":"1.0.0","analyst":"1.1.0"},"model":"fake:claude-sonnet-5-5","tokens":{"input":1455,"output":159,"cacheRead":1386},"estimatedCostUsd":0.004777,"latencyMs":80,"llmCalls":1,"fallbackReason":null,"guardrailEvents":[]}}
