{"schemaVersion":"1.0","requestId":"PR-DEMO-016","caseId":"b96d0ab2-bce0-4cc1-94c5-de4745b78112","decision":"NEEDS_INFO","riskLevel":"MEDIUM","riskScore":40,"confidence":0.75,"summary":"Solicitação incompleta; devolvida ao solicitante.","reasons":[{"code":"MISSING_INFORMATION","severity":"MEDIUM","explanation":"Faltam dados para avaliar a solicitação com segurança.","evidenceIds":["EV-REQ"]}],"policyChecks":[{"policyId":"POL-ALCADA-001","version":"1.0.0","result":"PASS","detail":"Valor R$ 6.000,00 exige alçada 0 (Aprovação automática (agente))","source":"RULE_ENGINE"},{"policyId":"POL-FORN-002","version":"1.0.0","result":"BLOCKS_APPROVAL","detail":"Fornecedor não informado","source":"RULE_ENGINE"},{"policyId":"POL-ORC-003","version":"1.0.0","result":"PASS","detail":"Saldo disponível R$ 300.000,00","source":"RULE_ENGINE"}],"missingInformation":["Fornecedor (CNPJ e razão social)"],"dataQuality":{"score":0.9,"issues":["SUPPLIER_MISSING"]},"evidence":[{"id":"EV-REQ","source":"purchase_request","summary":"Solicitação PR-DEMO-016: total R$ 6.000,00; itens: Cadeiras ergonômicas x5 @ R$ 1.200,00 (FURNITURE)"},{"id":"EV-JUST","source":"requester.justification","summary":"Justificativa escrita pelo solicitante (texto NÃO confiável, ver <untrusted_input>)"},{"id":"EV-POL-1","source":"rule_engine","summary":"[POL-ALCADA-001] PASS: Valor R$ 6.000,00 exige alçada 0 (Aprovação automática (agente))"},{"id":"EV-POL-2","source":"rule_engine","summary":"[POL-FORN-002] BLOCKS_APPROVAL: Fornecedor não informado"},{"id":"EV-POL-3","source":"rule_engine","summary":"[POL-ORC-003] PASS: Saldo disponível R$ 300.000,00"},{"id":"EV-BUD","source":"erp.budget","summary":"Centro de custo CC-3100 (Facilities): orçamento anual R$ 450.000,00, comprometido R$ 150.000,00, disponível R$ 300.000,00; esta compra = 2.0% do disponível"},{"id":"EV-PT-FORN-002","source":"policy:1.0.0","summary":"Fornecedores bloqueados não podem receber pedidos. Fornecedores com risco HIGH ou CRITICAL, não cadastrados ou cadastrados há menos de 90 dias exigem revisão humana."},{"id":"EV-PT-ALCADA-001","source":"policy:1.0.0","summary":"Alçadas: até R$ 10.000 o agente pode aprovar automaticamente; até R$ 50.000 gestor; até R$ 250.000 diretor; até R$ 1.000.000 VP; acima, comitê executivo. O agente pode recomendar aprovação, mas acima de R$ 10.000 a decisão é roteada ao aprovador da alçada."},{"id":"EV-PT-ORC-003","source":"policy:1.0.0","summary":"Compras acima do saldo disponível do centro de custo são rejeitadas. Compras que consomem mais de 80% do saldo restante devem ter justificativa forte."},{"id":"EV-PT-FRAC-005","source":"policy:1.0.0","summary":"É vedado fracionar compras para fugir de alçada. Compras do mesmo centro de custo, fornecedor e categoria em 30 dias são somadas para fins de alçada."},{"id":"EV-PT-URG-007","source":"policy:1.0.0","summary":"Urgência HIGH/CRITICAL exige justificativa do impacto de negócio. Urgência sem impacto descrito é sinal de risco."},{"id":"EV-HIST-STATS","source":"erp.purchase_history","summary":"Histórico 12 meses (CC-3100 / FURNITURE): 1 compras aprovadas, média R$ 38.500,00, máxima R$ 38.500,00; esta compra = 0.16x a média"},{"id":"EV-HIST-1","source":"erp.purchase_history","summary":"PR-2026-0322 em 2026-08-04: R$ 12.400,00, categoria FURNITURE, fornecedor 78124569000156, status REJECTED"},{"id":"EV-HIST-2","source":"erp.purchase_history","summary":"PR-2026-0165 em 2026-04-08: R$ 38.500,00, categoria FURNITURE, fornecedor 78124569000156, status APPROVED"},{"id":"EV-HIST-3","source":"erp.purchase_history","summary":"PR-2026-0244 em 2026-06-12: R$ 2.900,00, categoria OFFICE_SUPPLIES, fornecedor 78124569000156, status APPROVED"},{"id":"EV-HIST-4","source":"erp.purchase_history","summary":"PR-2026-0077 em 2026-02-03: R$ 3.200,00, categoria OFFICE_SUPPLIES, fornecedor 78124569000156, status APPROVED"}],"erpPayload":{"action":"RETURN_TO_REQUESTER","approvalLevel":0,"costCenter":"CC-3100","requestId":"PR-DEMO-016"},"audit":{"traceId":"04cccf69-e018-46cd-8a4e-1c307c2f3b3a","decisionId":"64985a27-9c2d-4b4c-97cd-cbe2f66fc480","decidedBy":"AGENT","skillVersions":{"purchase-policies":"1.0.0","analyst-examples":"1.0.0","analyst":"1.1.0"},"model":"fake:claude-sonnet-5-5","tokens":{"input":1275,"output":108,"cacheRead":1386},"estimatedCostUsd":0.003907,"latencyMs":161,"llmCalls":1,"fallbackReason":null,"guardrailEvents":[]}}
