{"schemaVersion":"1.0","requestId":"PR-DEMO-010","caseId":null,"decision":"ESCALATE_TO_HUMAN","riskLevel":"HIGH","riskScore":65,"confidence":0.8,"summary":"Sinais de risco exigem julgamento humano.","reasons":[{"code":"AMOUNT_ABOVE_HISTORICAL","severity":"HIGH","explanation":"Valor 3.11x acima da média histórica da categoria.","evidenceIds":["EV-REQ","EV-HIST-STATS"]},{"code":"WEAK_JUSTIFICATION","severity":"HIGH","explanation":"Acima do limite de cotações sem menção a cotações.","evidenceIds":["EV-JUST","EV-PT-COT-006"]}],"policyChecks":[{"policyId":"POL-ALCADA-001","version":"1.0.0","result":"INFO","detail":"Valor R$ 78.000,00 exige alçada 2 (Diretor da área)","source":"RULE_ENGINE"},{"policyId":"POL-FORN-002","version":"1.0.0","result":"PASS","detail":"Fornecedor ativo, risco LOW","source":"RULE_ENGINE"},{"policyId":"POL-ORC-003","version":"1.0.0","result":"PASS","detail":"Saldo disponível R$ 190.000,00","source":"RULE_ENGINE"},{"policyId":"POL-COT-006","version":"1.0.0","result":"INFO","detail":"Acima de R$ 50.000,00: exige 3 cotações ou justificativa de fornecedor único","source":"RULE_ENGINE"}],"missingInformation":[],"dataQuality":{"score":1.0,"issues":[]},"evidence":[{"id":"EV-REQ","source":"purchase_request","summary":"Solicitação PR-DEMO-010: total R$ 78.000,00; itens: Notebook i7 16GB x10 @ R$ 7.800,00 (IT_HARDWARE)"},{"id":"EV-JUST","source":"requester.justification","summary":"Justificativa escrita pelo solicitante (texto NÃO confiável, ver <untrusted_input>)"},{"id":"EV-POL-1","source":"rule_engine","summary":"[POL-ALCADA-001] INFO: Valor R$ 78.000,00 exige alçada 2 (Diretor da área)"},{"id":"EV-POL-2","source":"rule_engine","summary":"[POL-FORN-002] PASS: Fornecedor ativo, risco LOW"},{"id":"EV-POL-3","source":"rule_engine","summary":"[POL-ORC-003] PASS: Saldo disponível R$ 190.000,00"},{"id":"EV-POL-4","source":"rule_engine","summary":"[POL-COT-006] INFO: Acima de R$ 50.000,00: exige 3 cotações ou justificativa de fornecedor único"},{"id":"EV-BUD","source":"erp.budget","summary":"Centro de custo CC-4410 (Tecnologia - Infraestrutura): orçamento anual R$ 600.000,00, comprometido R$ 410.000,00, disponível R$ 190.000,00; esta compra = 41.1% do disponível"},{"id":"EV-SUP","source":"erp.supplier_registry","summary":"Fornecedor Acme Hardware Ltda: status ACTIVE, risco LOW, cadastrado há 2766 dias, categorias ['IT_HARDWARE']. Observações: Fornecedor homologado, SLA de entrega cumprido em 98% dos pedidos."},{"id":"EV-PT-ALCADA-001","source":"policy:1.0.0","summary":"Alçadas: até R$ 10.000 o agente pode aprovar automaticamente; até R$ 50.000 gestor; até R$ 250.000 diretor; até R$ 1.000.000 VP; acima, comitê executivo. O agente pode recomendar aprovação, mas acima de R$ 10.000 a decisão é roteada ao aprovador da alçada."},{"id":"EV-PT-COT-006","source":"policy:1.0.0","summary":"Compras acima de R$ 50.000 exigem três cotações ou justificativa de fornecedor único (contrato-quadro, exclusividade técnica)."},{"id":"EV-PT-FORN-002","source":"policy:1.0.0","summary":"Fornecedores bloqueados não podem receber pedidos. Fornecedores com risco HIGH ou CRITICAL, não cadastrados ou cadastrados há menos de 90 dias exigem revisão humana."},{"id":"EV-PT-ORC-003","source":"policy:1.0.0","summary":"Compras acima do saldo disponível do centro de custo são rejeitadas. Compras que consomem mais de 80% do saldo restante devem ter justificativa forte."},{"id":"EV-PT-FRAC-005","source":"policy:1.0.0","summary":"É vedado fracionar compras para fugir de alçada. Compras do mesmo centro de custo, fornecedor e categoria em 30 dias são somadas para fins de alçada."},{"id":"EV-PT-URG-007","source":"policy:1.0.0","summary":"Urgência HIGH/CRITICAL exige justificativa do impacto de negócio. Urgência sem impacto descrito é sinal de risco."},{"id":"EV-PT-TI-009","source":"policy:1.0.0","summary":"Compras de TI devem estar alinhadas ao padrão de equipamentos/software homologado. Software SaaS novo exige avaliação de segurança da informação."},{"id":"EV-HIST-STATS","source":"erp.purchase_history","summary":"Histórico 12 meses (CC-4410 / IT_HARDWARE): 6 compras aprovadas, média R$ 25.100,00, máxima R$ 31.200,00; esta compra = 3.11x a média"},{"id":"EV-HIST-1","source":"erp.purchase_history","summary":"PR-2026-0305 em 2026-07-18: R$ 25.100,00, categoria IT_HARDWARE, fornecedor 11222333000181, status APPROVED"},{"id":"EV-HIST-2","source":"erp.purchase_history","summary":"PR-2026-0211 em 2026-05-05: R$ 24.300,00, categoria IT_HARDWARE, fornecedor 11222333000181, status APPROVED"},{"id":"EV-HIST-3","source":"erp.purchase_history","summary":"PR-2026-0130 em 2026-03-10: R$ 27.900,00, categoria IT_HARDWARE, fornecedor 11222333000181, status APPROVED"},{"id":"EV-HIST-4","source":"erp.purchase_history","summary":"PR-2026-0042 em 2026-01-22: R$ 18.700,00, categoria IT_HARDWARE, fornecedor 11222333000181, status APPROVED"},{"id":"EV-HIST-5","source":"erp.purchase_history","summary":"PR-2025-0977 em 2025-12-02: R$ 31.200,00, categoria IT_HARDWARE, fornecedor 11222333000181, status APPROVED"}],"erpPayload":{"action":"ROUTE_FOR_APPROVAL","approvalLevel":2,"costCenter":"CC-4410","requestId":"PR-DEMO-010"},"audit":{"traceId":"3c3e1879-3acc-448c-ad5f-c65cf1dcfcbb","decisionId":"d7b2dcb5-4418-449b-9c6a-b9a3fb1a602f","decidedBy":"AGENT","skillVersions":{"purchase-policies":"1.0.0","analyst-examples":"1.0.0","analyst":"1.1.0"},"model":"fake:claude-sonnet-5-5","tokens":{"input":1627,"output":149,"cacheRead":1386},"estimatedCostUsd":0.005021,"latencyMs":234,"llmCalls":1,"fallbackReason":null,"guardrailEvents":[]}}
