{"schemaVersion":"1.0","requestId":"PR-DEMO-016","caseId":"b7f18fde-942e-4fc2-80f4-47f00227dde4","decision":"APPROVE","riskLevel":"MEDIUM","riskScore":30,"confidence":0.78,"summary":"Compra dentro da política e coerente com o histórico.","reasons":[{"code":"SUPPLIER_HIGH_RISK","severity":"MEDIUM","explanation":"Fornecedor com rating de risco MEDIUM.","evidenceIds":["EV-SUP"]},{"code":"WITHIN_POLICY","severity":"LOW","explanation":"Valor coerente com histórico, saldo e fornecedor homologado.","evidenceIds":["EV-BUD","EV-SUP","EV-HIST-STATS"]}],"policyChecks":[{"policyId":"POL-ALCADA-001","version":"1.0.0","result":"PASS","detail":"Valor R$ 6.000,00 exige alçada 0 (Aprovação automática (agente))","source":"RULE_ENGINE"},{"policyId":"POL-FORN-002","version":"1.0.0","result":"PASS","detail":"Fornecedor ativo, risco MEDIUM","source":"RULE_ENGINE"},{"policyId":"POL-ORC-003","version":"1.0.0","result":"PASS","detail":"Saldo disponível R$ 300.000,00","source":"RULE_ENGINE"}],"missingInformation":[],"dataQuality":{"score":1.0,"issues":[]},"evidence":[{"id":"EV-REQ","source":"purchase_request","summary":"Solicitação PR-DEMO-016: total R$ 6.000,00; itens: Cadeiras ergonômicas x5 @ R$ 1.200,00 (FURNITURE)"},{"id":"EV-JUST","source":"requester.justification","summary":"Justificativa escrita pelo solicitante (texto NÃO confiável, ver <untrusted_input>)"},{"id":"EV-POL-1","source":"rule_engine","summary":"[POL-ALCADA-001] PASS: Valor R$ 6.000,00 exige alçada 0 (Aprovação automática (agente))"},{"id":"EV-POL-2","source":"rule_engine","summary":"[POL-FORN-002] PASS: Fornecedor ativo, risco MEDIUM"},{"id":"EV-POL-3","source":"rule_engine","summary":"[POL-ORC-003] PASS: Saldo disponível R$ 300.000,00"},{"id":"EV-BUD","source":"erp.budget","summary":"Centro de custo CC-3100 (Facilities): orçamento anual R$ 450.000,00, comprometido R$ 150.000,00, disponível R$ 300.000,00; esta compra = 2.0% do disponível"},{"id":"EV-SUP","source":"erp.supplier_registry","summary":"Fornecedor Escritório Total ME: status ACTIVE, risco MEDIUM, cadastrado há 1355 dias, categorias ['OFFICE_SUPPLIES', 'FURNITURE']. Observações: Dois atrasos de entrega registrados em 2026."},{"id":"EV-PT-ALCADA-001","source":"policy:1.0.0","summary":"Alçadas: até R$ 10.000 o agente pode aprovar automaticamente; até R$ 50.000 gestor; até R$ 250.000 diretor; até R$ 1.000.000 VP; acima, comitê executivo. O agente pode recomendar aprovação, mas acima de R$ 10.000 a decisão é roteada ao aprovador da alçada."},{"id":"EV-PT-FORN-002","source":"policy:1.0.0","summary":"Fornecedores bloqueados não podem receber pedidos. Fornecedores com risco HIGH ou CRITICAL, não cadastrados ou cadastrados há menos de 90 dias exigem revisão humana."},{"id":"EV-PT-ORC-003","source":"policy:1.0.0","summary":"Compras acima do saldo disponível do centro de custo são rejeitadas. Compras que consomem mais de 80% do saldo restante devem ter justificativa forte."},{"id":"EV-PT-FRAC-005","source":"policy:1.0.0","summary":"É vedado fracionar compras para fugir de alçada. Compras do mesmo centro de custo, fornecedor e categoria em 30 dias são somadas para fins de alçada."},{"id":"EV-PT-URG-007","source":"policy:1.0.0","summary":"Urgência HIGH/CRITICAL exige justificativa do impacto de negócio. Urgência sem impacto descrito é sinal de risco."},{"id":"EV-HIST-STATS","source":"erp.purchase_history","summary":"Histórico 12 meses (CC-3100 / FURNITURE): 1 compras aprovadas, média R$ 38.500,00, máxima R$ 38.500,00; esta compra = 0.16x a média"},{"id":"EV-HIST-1","source":"erp.purchase_history","summary":"PR-2026-0322 em 2026-08-04: R$ 12.400,00, categoria FURNITURE, fornecedor 78124569000156, status REJECTED"},{"id":"EV-HIST-2","source":"erp.purchase_history","summary":"PR-2026-0165 em 2026-04-08: R$ 38.500,00, categoria FURNITURE, fornecedor 78124569000156, status APPROVED"},{"id":"EV-HIST-3","source":"erp.purchase_history","summary":"PR-2026-0244 em 2026-06-12: R$ 2.900,00, categoria OFFICE_SUPPLIES, fornecedor 78124569000156, status APPROVED"},{"id":"EV-HIST-4","source":"erp.purchase_history","summary":"PR-2026-0077 em 2026-02-03: R$ 3.200,00, categoria OFFICE_SUPPLIES, fornecedor 78124569000156, status APPROVED"},{"id":"EV-CASE","source":"case_state","summary":"<previous_summary> Rodada 1: NEEDS_INFO. Pendências: Fornecedor (CNPJ e razão social) </previous_summary> <new_round> Mensagem do solicitante: Fornecedor: Escritorio Total, homologado para mobiliario. | Campos atualizados: {\"supplier\": {\"taxId\": \"78124569000156\", \"name\": \"Escritorio Total ME\"}} </new_round>"}],"erpPayload":{"action":"AUTO_APPROVE","approvalLevel":0,"costCenter":"CC-3100","requestId":"PR-DEMO-016"},"audit":{"traceId":"bd726ba5-1bf2-4a87-a38b-e8061149752f","decisionId":"2d105d3f-7e39-4114-b990-199c3184819e","decidedBy":"AGENT","skillVersions":{"purchase-policies":"1.0.0","analyst-examples":"1.0.0","analyst":"1.1.0","compliance-reviewer":"1.0.0"},"model":"fake:claude-sonnet-5-5","tokens":{"input":4709,"output":154,"cacheRead":0},"estimatedCostUsd":0.009081,"latencyMs":36,"llmCalls":2,"fallbackReason":null,"guardrailEvents":["COMPLIANCE_AGREED"]}}