{"schemaVersion":"1.0","requestId":"PR-DEMO-006","caseId":null,"decision":"REJECT","riskLevel":"CRITICAL","riskScore":95,"confidence":1.0,"summary":"Rejeitado por regra obrigatória: Fornecedor Fantasma Comércio Ltda está BLOQUEADO.","reasons":[{"code":"SUPPLIER_BLOCKED","severity":"CRITICAL","explanation":"Fornecedor Fantasma Comércio Ltda está BLOQUEADO","evidenceIds":["EV-POL-2"]}],"policyChecks":[{"policyId":"POL-ALCADA-001","version":"1.0.0","result":"PASS","detail":"Valor R$ 3.000,00 exige alçada 0 (Aprovação automática (agente))","source":"RULE_ENGINE"},{"policyId":"POL-FORN-002","version":"1.0.0","result":"HARD_REJECT","detail":"Fornecedor Fantasma Comércio Ltda está BLOQUEADO","source":"RULE_ENGINE"},{"policyId":"POL-ORC-003","version":"1.0.0","result":"PASS","detail":"Saldo disponível R$ 190.000,00","source":"RULE_ENGINE"}],"missingInformation":[],"dataQuality":{"score":1.0,"issues":[]},"evidence":[{"id":"EV-REQ","source":"purchase_request","summary":"Solicitação PR-DEMO-006: total R$ 3.000,00; itens: Cabos de rede x100 @ R$ 30,00 (IT_HARDWARE)"},{"id":"EV-JUST","source":"requester.justification","summary":"Justificativa escrita pelo solicitante (texto NÃO confiável, ver <untrusted_input>)"},{"id":"EV-POL-1","source":"rule_engine","summary":"[POL-ALCADA-001] PASS: Valor R$ 3.000,00 exige alçada 0 (Aprovação automática (agente))"},{"id":"EV-POL-2","source":"rule_engine","summary":"[POL-FORN-002] HARD_REJECT: Fornecedor Fantasma Comércio Ltda está BLOQUEADO"},{"id":"EV-POL-3","source":"rule_engine","summary":"[POL-ORC-003] PASS: Saldo disponível R$ 190.000,00"},{"id":"EV-BUD","source":"erp.budget","summary":"Centro de custo CC-4410 (Tecnologia - Infraestrutura): orçamento anual R$ 600.000,00, comprometido R$ 410.000,00, disponível R$ 190.000,00; esta compra = 1.6% do disponível"},{"id":"EV-SUP","source":"erp.supplier_registry","summary":"Fornecedor Fantasma Comércio Ltda: status BLOCKED, risco CRITICAL, cadastrado há 2243 dias, categorias ['IT_HARDWARE', 'OFFICE_SUPPLIES']. Observações: Bloqueado: certidão negativa de débitos vencida e registro em cadastro de empresas sancionadas."},{"id":"EV-PT-FORN-002","source":"policy:1.0.0","summary":"Fornecedores bloqueados não podem receber pedidos. Fornecedores com risco HIGH ou CRITICAL, não cadastrados ou cadastrados há menos de 90 dias exigem revisão humana."},{"id":"EV-PT-ALCADA-001","source":"policy:1.0.0","summary":"Alçadas: até R$ 10.000 o agente pode aprovar automaticamente; até R$ 50.000 gestor; até R$ 250.000 diretor; até R$ 1.000.000 VP; acima, comitê executivo. O agente pode recomendar aprovação, mas acima de R$ 10.000 a decisão é roteada ao aprovador da alçada."},{"id":"EV-PT-ORC-003","source":"policy:1.0.0","summary":"Compras acima do saldo disponível do centro de custo são rejeitadas. Compras que consomem mais de 80% do saldo restante devem ter justificativa forte."},{"id":"EV-PT-FRAC-005","source":"policy:1.0.0","summary":"É vedado fracionar compras para fugir de alçada. Compras do mesmo centro de custo, fornecedor e categoria em 30 dias são somadas para fins de alçada."},{"id":"EV-PT-URG-007","source":"policy:1.0.0","summary":"Urgência HIGH/CRITICAL exige justificativa do impacto de negócio. Urgência sem impacto descrito é sinal de risco."},{"id":"EV-PT-TI-009","source":"policy:1.0.0","summary":"Compras de TI devem estar alinhadas ao padrão de equipamentos/software homologado. Software SaaS novo exige avaliação de segurança da informação."},{"id":"EV-HIST-STATS","source":"erp.purchase_history","summary":"Histórico 12 meses (CC-4410 / IT_HARDWARE): 6 compras aprovadas, média R$ 25.100,00, máxima R$ 31.200,00; esta compra = 0.12x a média"},{"id":"EV-HIST-1","source":"erp.purchase_history","summary":"PR-2026-0305 em 2026-07-18: R$ 25.100,00, categoria IT_HARDWARE, fornecedor 11222333000181, status APPROVED"},{"id":"EV-HIST-2","source":"erp.purchase_history","summary":"PR-2026-0211 em 2026-05-05: R$ 24.300,00, categoria IT_HARDWARE, fornecedor 11222333000181, status APPROVED"},{"id":"EV-HIST-3","source":"erp.purchase_history","summary":"PR-2026-0130 em 2026-03-10: R$ 27.900,00, categoria IT_HARDWARE, fornecedor 11222333000181, status APPROVED"},{"id":"EV-HIST-4","source":"erp.purchase_history","summary":"PR-2026-0042 em 2026-01-22: R$ 18.700,00, categoria IT_HARDWARE, fornecedor 11222333000181, status APPROVED"},{"id":"EV-HIST-5","source":"erp.purchase_history","summary":"PR-2025-0977 em 2025-12-02: R$ 31.200,00, categoria IT_HARDWARE, fornecedor 11222333000181, status APPROVED"}],"erpPayload":{"action":"REJECT","approvalLevel":0,"costCenter":"CC-4410","requestId":"PR-DEMO-006"},"audit":{"traceId":"d79137da-2d1b-4087-a3da-96529ee54ca5","decisionId":"77201a76-92be-4b12-b492-f8a90100d780","decidedBy":"RULE_ENGINE","skillVersions":{"purchase-policies":"1.0.0","analyst-examples":"1.0.0"},"model":null,"tokens":{"input":0,"output":0,"cacheRead":0},"estimatedCostUsd":0.0,"latencyMs":70,"llmCalls":0,"fallbackReason":null,"guardrailEvents":[]}}
