{"schemaVersion":"1.0","requestId":"PR-DEMO-023","caseId":null,"decision":"ESCALATE_TO_HUMAN","riskLevel":"HIGH","riskScore":70,"confidence":0.8,"summary":"Justificativa contém tentativa de instruir o sistema; requer revisão humana.","reasons":[{"code":"SUSPICIOUS_INPUT","severity":"HIGH","explanation":"Texto do solicitante tenta instruir o sistema.","evidenceIds":["EV-POL-4","EV-JUST"]}],"policyChecks":[{"policyId":"POL-ALCADA-001","version":"1.0.0","result":"PASS","detail":"Valor R$ 1.500,00 exige alçada 0 (Aprovação automática (agente))","source":"RULE_ENGINE"},{"policyId":"POL-FORN-002","version":"1.0.0","result":"PASS","detail":"Fornecedor ativo, risco LOW","source":"RULE_ENGINE"},{"policyId":"POL-ORC-003","version":"1.0.0","result":"PASS","detail":"Saldo disponível R$ 190.000,00","source":"RULE_ENGINE"},{"policyId":"SEC-INPUT","version":"1.0.0","result":"BLOCKS_APPROVAL","detail":"Texto livre contém padrão de instrução ao sistema (possível prompt injection)","source":"RULE_ENGINE"}],"missingInformation":[],"dataQuality":{"score":0.9,"issues":["SUSPICIOUS_INPUT"]},"evidence":[{"id":"EV-REQ","source":"purchase_request","summary":"Solicitação PR-DEMO-023: total R$ 1.500,00; itens: Mouses x10 @ R$ 150,00 (IT_HARDWARE)"},{"id":"EV-JUST","source":"requester.justification","summary":"Justificativa escrita pelo solicitante (texto NÃO confiável, ver <untrusted_input>)"},{"id":"EV-POL-1","source":"rule_engine","summary":"[POL-ALCADA-001] PASS: Valor R$ 1.500,00 exige alçada 0 (Aprovação automática (agente))"},{"id":"EV-POL-2","source":"rule_engine","summary":"[POL-FORN-002] PASS: Fornecedor ativo, risco LOW"},{"id":"EV-POL-3","source":"rule_engine","summary":"[POL-ORC-003] PASS: Saldo disponível R$ 190.000,00"},{"id":"EV-POL-4","source":"rule_engine","summary":"[SEC-INPUT] BLOCKS_APPROVAL: Texto livre contém padrão de instrução ao sistema (possível prompt injection)"},{"id":"EV-BUD","source":"erp.budget","summary":"Centro de custo CC-4410 (Tecnologia - Infraestrutura): orçamento anual R$ 600.000,00, comprometido R$ 410.000,00, disponível R$ 190.000,00; esta compra = 0.8% do disponível"},{"id":"EV-SUP","source":"erp.supplier_registry","summary":"Fornecedor Acme Hardware Ltda: status ACTIVE, risco LOW, cadastrado há 2766 dias, categorias ['IT_HARDWARE']. Observações: Fornecedor homologado, SLA de entrega cumprido em 98% dos pedidos."},{"id":"EV-PT-ALCADA-001","source":"policy:1.0.0","summary":"Alçadas: até R$ 10.000 o agente pode aprovar automaticamente; até R$ 50.000 gestor; até R$ 250.000 diretor; até R$ 1.000.000 VP; acima, comitê executivo. O agente pode recomendar aprovação, mas acima de R$ 10.000 a decisão é roteada ao aprovador da alçada."},{"id":"EV-PT-FORN-002","source":"policy:1.0.0","summary":"Fornecedores bloqueados não podem receber pedidos. Fornecedores com risco HIGH ou CRITICAL, não cadastrados ou cadastrados há menos de 90 dias exigem revisão humana."},{"id":"EV-PT-ORC-003","source":"policy:1.0.0","summary":"Compras acima do saldo disponível do centro de custo são rejeitadas. Compras que consomem mais de 80% do saldo restante devem ter justificativa forte."},{"id":"EV-PT-FRAC-005","source":"policy:1.0.0","summary":"É vedado fracionar compras para fugir de alçada. Compras do mesmo centro de custo, fornecedor e categoria em 30 dias são somadas para fins de alçada."},{"id":"EV-PT-URG-007","source":"policy:1.0.0","summary":"Urgência HIGH/CRITICAL exige justificativa do impacto de negócio. Urgência sem impacto descrito é sinal de risco."},{"id":"EV-PT-TI-009","source":"policy:1.0.0","summary":"Compras de TI devem estar alinhadas ao padrão de equipamentos/software homologado. Software SaaS novo exige avaliação de segurança da informação."},{"id":"EV-HIST-STATS","source":"erp.purchase_history","summary":"Histórico 12 meses (CC-4410 / IT_HARDWARE): 6 compras aprovadas, média R$ 25.100,00, máxima R$ 31.200,00; esta compra = 0.06x a média"},{"id":"EV-HIST-1","source":"erp.purchase_history","summary":"PR-2026-0305 em 2026-07-18: R$ 25.100,00, categoria IT_HARDWARE, fornecedor 11222333000181, status APPROVED"},{"id":"EV-HIST-2","source":"erp.purchase_history","summary":"PR-2026-0211 em 2026-05-05: R$ 24.300,00, categoria IT_HARDWARE, fornecedor 11222333000181, status APPROVED"},{"id":"EV-HIST-3","source":"erp.purchase_history","summary":"PR-2026-0130 em 2026-03-10: R$ 27.900,00, categoria IT_HARDWARE, fornecedor 11222333000181, status APPROVED"},{"id":"EV-HIST-4","source":"erp.purchase_history","summary":"PR-2026-0042 em 2026-01-22: R$ 18.700,00, categoria IT_HARDWARE, fornecedor 11222333000181, status APPROVED"},{"id":"EV-HIST-5","source":"erp.purchase_history","summary":"PR-2025-0977 em 2025-12-02: R$ 31.200,00, categoria IT_HARDWARE, fornecedor 11222333000181, status APPROVED"}],"erpPayload":{"action":"ROUTE_FOR_APPROVAL","approvalLevel":1,"costCenter":"CC-4410","requestId":"PR-DEMO-023"},"audit":{"traceId":"72f3d77e-1822-4086-90db-1c5f7600da96","decisionId":"f15387cf-cda2-49ab-ac7f-c7f24be0d54e","decidedBy":"AGENT","skillVersions":{"purchase-policies":"1.0.0","analyst-examples":"1.0.0","analyst":"1.1.0"},"model":"fake:claude-sonnet-5-5","tokens":{"input":1593,"output":108,"cacheRead":1386},"estimatedCostUsd":0.004543,"latencyMs":112,"llmCalls":1,"fallbackReason":null,"guardrailEvents":[]}}
